<?xml version="1.0" encoding="ISO-8859-1"?>
<livre 
  xmlns:xsi="http://www.w3.org/2001/XMLSchema-instance"
  xsi:noNamespaceSchemaLocation="livre2.xsd" 
  titre="livre 2">
	<auteurs>
		<auteur nom="Hamdi" prenom="Mohamed"/>
		<auteur nom="Mahmoud" prenom="Ahmed"/>
	</auteurs>
	<sections>
		<section titre="section 1">
			<chapitre titre="chapitre 1">
				<paragraphe>Exemple de paragraphe</paragraphe>
				<paragraphe>Exemple de paragraphe</paragraphe>
			</chapitre>
			<chapitre titre="chapitre 2">
				<paragraphe>Exemple de paragraphe</paragraphe>
				<paragraphe>Exemple de paragraphe</paragraphe>
			</chapitre>
		</section>
		<section titre="section 2">
			<chapitre titre="chapitre 1">
				<paragraphe>Exemple de paragraphe</paragraphe>
				<paragraphe>Exemple de paragraphe</paragraphe>
			</chapitre>
			<chapitre titre="chapitre 2">
				<paragraphe>Exemple de paragraphe</paragraphe>
				<paragraphe>Exemple de paragraphe</paragraphe>
			</chapitre>
		</section>
	</sections>
</livre>